title,description,content,category,country,language
When Paradise Trembles: A Hidden Symphony of Life After the Ashes,,"[""Deep in the heart of Mayon's shadow, where coconut trees once stood proud against the Bicol sky, nature orchestrates a remarkable performance that few witness. As the morning sun pierces through steam vents, casting ethereal shadows across the landscape, a peculiar truth emerges: volcanoes aren't just destroyers – they're master gardeners of evolution. ""The land speaks to us in cycles,"" explains Dr. Maria Santos, a volcanologist at the University of the Philippines. ""What appears as devastation today becomes tomorrow's cradle of life."" This paradox plays out dramatically across the Philippines' volcanic corridors, where more than 20 active volcanoes shape not just the terrain, but the very essence of life itself. Consider the aftermath of Mount Pinatubo's 1991 eruption. What seemed like apocalyptic destruction unveiled nature's resilient blueprint. Within months, pioneer species of ferns and mosses emerged from the ash-laden soil, their spores carried by winds across the devastated landscape. These humble beginners paved the way for an ecological renaissance that scientists are still studying today. The secret lies in the volcanic soil's chemistry. Rich in phosphorus and potassium, volcanic ash creates a fertile foundation that transforms seemingly dead zones into biodiversity hotspots. Local farmers have long known this truth, with some of the Philippines' most productive agricultural lands thriving in volcanic regions. But it's not just about soil fertility. The dance between destruction and creation creates unique microhabitats. In the steaming vents around Taal Volcano, heat-loving bacteria thrive, offering glimpses into life's adaptability. These extremophiles, as scientists call them, might hold keys to understanding both Earth's earliest life forms and potential life on other planets. The impact ripples through entire ecosystems. Birds adapt their nesting patterns, insects evolve new survival strategies, and plant species develop remarkable resilience. ""It's like watching evolution in fast-forward,"" notes wildlife biologist Juan dela Cruz, who has documented over 50 species of birds returning to previously devastated areas within just five years of volcanic activity. For local communities, this natural cycle carries profound lessons about resilience and adaptation. Traditional knowledge passed down through generations speaks of reading the land's signals and working in harmony with these powerful forces rather than against them. As we face a changing climate, these volcanic ecosystems offer valuable insights into nature's extraordinary capacity for renewal. They remind us that in the grand symphony of life, even the most dramatic disruptions can lead to unexpected harmonies – if we're patient enough to watch the performance unfold. The next time Mayon or Taal reminds us of their presence, remember: we're witnessing not just destruction, but the opening notes of nature's most impressive composition – the song of rebirth and renewal in our Ring of Fire.""]",Nature,PH,en
Hidden Rivers: The Secret World Beneath Your Feet,,"[""Deep beneath the limestone hills of Palawan lies a natural wonder that few have glimpsed – a sprawling network of underground rivers that whispers tales of Earth's ancient past. Like nature's own secret subway system, these aquatic labyrinths carve through rock with patient persistence, creating some of our planet's most mysterious ecosystems. ""It's like discovering an entirely new world,"" says Dr. Maria Santos, a cave hydrologist who has spent two decades studying the Puerto Princesa Underground River. ""These systems aren't just empty tunnels – they're living, breathing environments that support unique forms of life."" Underground rivers form when slightly acidic rainwater seeps through limestone, slowly dissolving the rock to create vast networks of caves and channels. Think of it as nature's own architectural project, where water acts as both designer and builder, working tirelessly over millions of years. What makes these subterranean waterways truly remarkable is their role as Earth's hidden highways. They transport minerals, sustain rare species, and even influence the stability of land above. In the Callao Cave system of Cagayan, researchers have discovered blind fish that have evolved to navigate in complete darkness, their eyes replaced by highly sensitive pressure sensors. But these underground marvels face mounting challenges. Climate change and human activity threaten to alter their delicate chemistry. ""When surface pollution enters these systems, it's like poisoning the veins of the Earth,"" explains Santos. ""Everything downstream feels the impact."" Conservation efforts are now focusing on mapping and protecting these underwater networks. Using advanced sonar technology and cave diving techniques, scientists are racing to understand these systems before they're irreversibly changed. Their findings reveal that underground rivers don't just flow – they connect entire ecosystems, from mountaintop to sea. For Filipinos, these hidden rivers represent more than scientific curiosities. They're part of our natural heritage, providing fresh water, supporting agriculture, and attracting eco-tourists from around the globe. As we learn more about these mysterious waterways, one thing becomes clear: the future of what flows above depends largely on what flows below. The next time you walk across limestone terrain, remember – you're standing on the roof of nature's most spectacular hidden highway system, where rivers flow in eternal darkness, sculpting the very foundation of our landscapes.""]",Nature,PH,en
Nature's Underwater Phoenix: How Dead Reefs Spring Back to Life in Philippine Waters,,"[""In the azure waters off Tubbataha Reefs Natural Park, a remarkable transformation is taking place. Like a phoenix rising from the ashes, vibrant coral colonies are emerging from what was once a bleached, lifeless seascape. This natural resurrection story offers hope for marine ecosystems worldwide and highlights the remarkable resilience of our ocean's most diverse habitats. ""The reef's ability to bounce back continues to amaze us,"" says Dr. Maria Santos, a marine biologist who has studied Philippine coral reefs for over two decades. ""It's like watching a bustling city rebuild itself after a storm – every coral polyp plays its part in the reconstruction."" The recovery process follows a fascinating pattern that scientists have only recently begun to fully understand. When typhoons or bleaching events strike, they leave behind what appears to be underwater devastation. But beneath this apparent destruction, nature has already set its recovery plan in motion. Fast-growing branching corals, locally known as ""sanga-sanga,"" are often the first to recolonize damaged areas. These pioneer species create essential structure and shelter for fish communities, much like how nipa huts provide the foundation for developing coastal villages. Within three to five years, these coral communities can transform from barren rubble into thriving ecosystems. But the true magic happens in the genetic diversity of surviving corals. Those that withstand natural disasters often possess stronger genes, passing these resilient traits to future generations. ""It's natural selection in action,"" explains Santos. ""Each disturbance event potentially creates stronger, more adaptable reef systems."" The Philippine archipelago offers a unique laboratory for studying this phenomenon. Our country's location in the Coral Triangle means our reefs face frequent challenges – from typhoons to crown-of-thorns starfish outbreaks. Yet these same pressures have helped develop some of the world's most resilient reef systems. Local communities play a crucial role in this recovery process. Traditional fishing practices that allow reefs ""rest periods"" and the establishment of marine protected areas have given damaged ecosystems the time they need to heal. In the Visayas, where community-managed marine sanctuaries have become common, reef recovery rates are significantly higher than in unprotected areas. The lesson here isn't just about coral reefs – it's about hope and resilience in the face of adversity. As climate change poses increasing threats to marine ecosystems, understanding and supporting natural recovery processes becomes crucial. Our reefs remind us that with proper protection and patience, nature has an extraordinary ability to heal itself. For those wondering how to support this natural recovery, the answer lies in simple actions: supporting local marine protected areas, practicing responsible tourism, and reducing plastic waste. Every small step helps these underwater phoenixes rise again, ensuring the survival of these crucial ecosystems for generations to come.""]",Nature,PH,en
Dancing with the Moon: How Philippine Waters Perform Nature's Greatest Ballet,,"[""In the heart of the Pacific, where over 7,600 islands create a symphony of currents, the Philippine archipelago hosts one of nature's most mesmerizing performances. Like dancers responding to an invisible conductor, our waters rise and fall in a rhythm that has captivated generations of islanders and puzzled scientists alike. ""What many Filipinos see as just another day at the beach is actually a complex underwater ballet,"" explains Dr. Maria Santos of the Philippine Atmospheric, Geophysical and Astronomical Services Administration (PAGASA). The interplay between our scattered islands creates unique tidal patterns found nowhere else on Earth. Picture this: while fishermen in Batanes navigate swirling waters between islands, their counterparts in Sulu deal with entirely different tidal personalities. These differences aren't just geographical quirks – they're the result of our archipelago's distinctive underwater topography, where deep trenches and shallow coral reefs create their own choreography with passing waters. The phenomenon becomes particularly fascinating during habagat and amihan seasons. When monsoon winds push against tidal forces, they create what local fishermen call ""tubig-taob"" – extreme high tides that can rise up to two meters higher than normal. These events, far from being mere inconveniences, have shaped Filipino coastal culture for centuries. In Bataan's fishing communities, generations have learned to read these waters like a well-worn book. ""Our grandparents didn't need tide tables,"" shares Manuel Dela Cruz, a third-generation fisherman. ""They could tell you tomorrow's tide just by looking at the moon and feeling the wind direction."" This traditional knowledge, passed down through generations, is now being validated by modern science. But these tidal dances aren't just about fishing schedules. They're crucial players in our marine ecosystem's health. The regular flushing of water through our mangrove forests, for instance, helps maintain these critical nurseries for marine life. During spring tides, when the sun and moon align their gravitational pull, these waters surge with particular strength, bringing nutrients to coastal communities both human and marine. Scientists are now discovering how our archipelagic waters create unique ""tidal mixing zones"" – areas where different water masses meet and mingle, creating hotspots of marine biodiversity. These zones, particularly prominent in the Visayan Sea, help explain why Philippine waters host some of the world's richest marine life. Understanding these patterns isn't just about preserving tradition or satisfying scientific curiosity. As climate change threatens to alter these ancient rhythms, knowing how our waters dance could be key to protecting our coastal communities. The next time you're at a Philippine beach, remember: you're witnessing not just waves, but a sophisticated performance that's been running for millions of years – one that makes our archipelago truly unique in the world's oceans.""]",Nature,PH,en
The Dance of Death in Paradise: How Our Seas Turn from Blue to Blood-Red,,"[""In the crystal-clear waters off Siargao, where surfers once caught perfect waves and fishermen hauled abundant catches, an eerie transformation is unfolding. The ocean, usually a symphony of blues, now pulses with an unsettling crimson glow. Local fisherman Manuel Santos remembers the first time he witnessed it: ""Para kang nakatingin sa dagat ng dugo,"" he says, his weathered hands gripping the side of his bangka. This crimson invader, known scientifically as red tide, is more than just a striking visual phenomenon – it's a complex dance between microscopic organisms and our changing marine environment. These tiny dynoflagellates, multiplying by the millions, paint our waters red while weaving a story of ecological disruption that affects everyone from small-scale fishermen to luxury resort owners. But what triggers this crimson cascade? Dr. Maria Cruz of the Philippine Marine Science Institute points to a perfect storm of conditions. ""We're seeing warmer waters, increased coastal nutrients from urban runoff, and changing ocean chemistry,"" she explains. ""It's like providing these organisms with an all-you-can-eat buffet in a perfect temperature-controlled environment."" The impact ripples through our marine ecosystem like dominoes falling in slow motion. As these microscopic organisms bloom, they release potent toxins that can paralyze fish and contaminate shellfish. Local economies suffer – in 2022 alone, red tide events cost Philippine coastal communities an estimated ₱500 million in lost fishing revenue. Yet nature, in its infinite wisdom, has always maintained delicate balances. Traditional fishing communities along our 7,641 islands have long recognized warning signs: unusual water coloration, dead fish washing ashore, or sudden changes in seabird behavior. This indigenous knowledge, combined with modern scientific monitoring, now forms our first line of defense. Hope swims beneath the surface of this crimson challenge. Innovative solutions are emerging from our own waters. In Zambales, local communities have restored mangrove forests that act as natural filters, reducing the nutrients that fuel these blooms. Meanwhile, scientists at UP Marine Science Institute are developing early warning systems using satellite technology and artificial intelligence. The key to maintaining our marine ecosystem's balance lies in understanding that we're not just fighting against red tide – we're working to restore nature's rhythm. As Dr. Cruz reminds us, ""The ocean is not just a resource to be harvested; it's a partner in our survival."" For Manuel and countless others who depend on our seas, the solution requires a blend of traditional wisdom and modern science. By respecting these ancient waters while embracing new understanding, we can help restore the delicate dance between humans and ocean, ensuring our seas remain vibrantly blue rather than ominously red.""]",Nature,PH,en
Dancing with the Devils: How Nature's Water Tornados Mesmerize Island Life,,"[""In the crystalline waters surrounding our Philippine archipelago, a mystifying spectacle occasionally graces our horizon – towering columns of water that seem to bridge sea and sky. These aren't your lolo's ghost stories; they're waterspouts, nature's own version of a cosmic ballet. Picture this: a peaceful morning at Boracay's shores suddenly transforms as a dark funnel descends from cotton-candy clouds, drawing seawater upward like a giant drinking straw. ""It's like watching God's own tinikling dance,"" describes local fisherman Manuel Santos, who has witnessed dozens of these phenomena during his 30 years at sea. But what orchestrates this magnificent display? Dr. Elena Rodriguez, a meteorologist at PAGASA, explains that these aerial performances require a perfect storm of conditions. ""Think of it as nature's pressure cooker,"" she says. ""When cool, condensation-filled clouds hover over warm tropical waters, they create an atmospheric instability that rivals a teenager's mood swings."" The birth of a waterspout begins invisibly – warm, moist air rises rapidly while cool air descends, creating a violent spiral dance. As the vortex intensifies, it becomes visible first as a dark spot on the water's surface, surrounded by a bright ring locals call ""mata ng dagat"" (eye of the sea). Within minutes, the full column materializes, often stretching 50-100 meters skyward. Unlike their more destructive cousins, typhoons, most waterspouts are relatively harmless and short-lived, typically lasting 5-10 minutes. However, they command respect from maritime communities. Bangka operators know to give these natural phenomena a wide berth – typically 3-4 kilometers – as even smaller waterspouts can lift several tons of water into the air. For scientists studying climate patterns, these ethereal formations serve as important indicators. ""Waterspouts are like nature's thermometers,"" explains Rodriguez. ""Their increasing frequency in traditionally calm waters may signal changing ocean temperatures and atmospheric patterns."" Whether you're a weekend beach-goer or a seasoned mariner, spotting a waterspout remains an unforgettable experience. Just remember nature's golden rule: admire from afar, respect the distance, and never underestimate the power of these dancing devils of the sea. The next time you're island-hopping and spot a peculiar column of water reaching for the heavens, you'll know you're witnessing one of nature's most captivating performances – just make sure you're watching from the safety of solid ground.""]",Nature,PH,en
Whispers in the Wind: How Mountain Breezes Shape Our Island Life,,"[""In the cool dawn hours, as fishermen prepare their bangkas along the shores of Batanes, an ancient dance unfolds above them. The mountains, those silent sentinels of our archipelago, orchestrate an invisible ballet that shapes not just their morning catch, but the very essence of life in our islands. Like a giant natural air conditioner, our mountain ranges choreograph the movement of winds with remarkable precision. When the sun warms the mountainsides, it creates what local elders call ""hanging-amihan"" – upslope winds that carry moisture from the valleys to the peaks. These daily performances aren't merely meteorological curiosities; they're the architects of our local weather patterns. ""The mountains are our weather makers,"" explains Dr. Maria Santos of the Philippine Atmospheric, Geophysical and Astronomical Services Administration (PAGASA). ""When warm air rises along our mountainsides, it creates low-pressure areas that pull in cooler air from the surrounding lowlands, much like how your grandmother's electric fan creates circulation in a warm room."" This mountain-driven circulation produces fascinating local phenomena. In Benguet's vegetable gardens, farmers have long understood that the afternoon winds, locally known as ""palusdos,"" bring the perfect combination of cool temperatures and moisture for their crops. These predictable patterns have shaped agricultural practices for generations, determining when to plant, when to harvest, and even how to arrange terraces to maximize natural irrigation. But there's a darker side to this atmospheric dance. As climate change alters global weather patterns, our mountain winds are becoming increasingly unpredictable. Traditional farming calendars, passed down through generations, are losing their reliability. Where once the mountain winds brought gentle rains, they now sometimes deliver intense downpours or unexpected dry spells. Understanding these patterns isn't just about weather forecasting – it's about cultural preservation and adaptation. In Sagada, local communities are combining traditional knowledge with modern weather monitoring to maintain their famous hanging rice terraces. They're learning to read new signs in the wind, adapting centuries-old farming techniques to a changing climate. For visitors and locals alike, these mountain wind patterns offer more than just meteorological interest. They create unique microclimates that give each region its distinct character – from the cool, misty mornings of Tagaytay to the warm, breezy afternoons in Baguio City. They're part of what makes each Philippine destination uniquely special. As we face an uncertain climatic future, these mountain winds remind us of nature's intricate balance and our place within it. They carry not just cool breezes and rain clouds, but the whispered wisdom of generations who learned to live in harmony with these aerial rhythms. The next time you feel a mountain breeze on your face, remember: you're experiencing part of an ancient, ongoing story – one written in the invisible ink of wind across our beloved highlands, telling tales of weather, wisdom, and change.""]",Nature,PH,en
Nature's Sky Paths: The Hidden Wonders Above Our Jungle Trails,,"[""Deep in the heart of Palawan's limestone cliffs, where emerald forests meet ancient stone, nature has crafted architectural marvels that defy gravity and imagination. These natural land bridges, suspended like frozen waterfalls of rock, tell stories that stretch back millions of years. ""Standing beneath these formations feels like discovering ancient portals,"" says Dr. Maria Santos, a geologist from the University of the Philippines. ""Each one represents thousands of years of patient sculpting by water and wind."" These magnificent structures, which locals have long considered sacred pathways, form when softer rock layers erode while harder layers remain, creating spectacular stone arches that seem to float in mid-air. The process begins innocently enough – with a simple drop of water. Over centuries, these droplets, combined with acidic rainfall and persistent wind, carve through limestone and sandstone layers. The result? Massive stone bridges that can span hundreds of feet, supporting their own weight through natural engineering that would make modern architects envious. But these skyward passages face mounting challenges. Climate change-induced extreme weather events threaten their stability, while increasing tourism poses risks to their delicate ecosystems. In Northern Luzon, where several remarkable land bridges draw adventure seekers, local communities have taken innovative approaches to preservation. The Sagada Environmental Protection Society has pioneered a ""guardian system,"" where indigenous knowledge meets modern conservation. ""Our ancestors knew these bridges as nature's highways,"" explains tribal elder Manuel Bakawan. ""Now we're teaching visitors to treat them like the treasures they are – look, learn, but leave no trace."" These efforts are paying off. New mapping technologies have identified previously unknown land bridges in remote areas, while community-led initiatives help protect known formations. Scientists estimate that the Philippines may house dozens more undiscovered natural bridges, each holding clues to our geological past. For those yearning to witness these stone sentinels, remember: they're more than just Instagram-worthy spots. They're living laboratories of erosion and endurance, teaching us about the power of patience and the artistry of time. As we work to preserve these natural wonders, we're not just saving stone arches – we're protecting portals to our planet's past and future. Next time you're hiking through our country's diverse landscapes, look up. That bridge above might be nature's own masterpiece, crafted over millennia, waiting to tell its story to those who pause long enough to listen.""]",Nature,PH,en
