title,description,content,category,country,language
Sweet Nostalgia Gets a Glow-Up: Why Your Lola's Kakanin Is Going Viral,,"[""Remember those lazy Sunday mornings at your grandmother's house, the air thick with the sweet aroma of freshly steamed rice cakes? Well, guess what – those beloved kakanin recipes are getting a modern makeover, and you won't believe what today's innovative home cooks are doing with these Filipino classics! I recently discovered a whole new world of kakanin creativity when I stumbled upon Chef Maya Santos's viral ube-cheese puto. ""Our traditional recipes are treasures,"" she told me, ""but who says we can't have a little fun with them?"" And fun she's definitely having! Her purple-swirled puto, stuffed with melty cheese and topped with crispy coconut crumbs, has taken social media by storm. But it's not just puto getting a fresh spin. Innovative food entrepreneurs are transforming bibingka into convenient grab-and-go cups, complete with salted egg foam and neon-bright ube drizzle. And have you seen those bite-sized sapin-sapin squares that look like tiny jewels? They're infused with matcha, activated charcoal, and even butterfly pea flower for that Instagram-worthy color pop! Here's my favorite twist on traditional palitaw that you can easily try at home: Ube-Macapuno Palitaw - Replace regular glutinous rice flour with ube-flavored flour - Roll in desiccated coconut mixed with crushed macapuno - Add a sprinkle of sea salt for that sweet-salty kick The secret to successful kakanin innovation? Keep the soul of the original recipe intact while adding unexpected elements. Think of it as giving your lola's recipes a trendy outfit – same personality, fresh look! Pro tip: When experimenting with new flavors, start with small batches. I learned this the hard way after an unfortunate incident involving wasabi-flavored kutsinta (trust me, some boundaries aren't meant to be crossed!). Whether you're a seasoned cook or just starting your kakanin journey, there's never been a more exciting time to play with these beloved treats. Just remember – innovation is great, but don't forget to pay homage to the original recipes that have brought joy to Filipino families for generations. Now, who's ready to give their family's traditional kakanin recipe a modern twist?""]",Food,PH,en
Beat the Heat: These 5-Minute Sweet Treats Will Make Your Aircon Jealous,,"[""In the midst of another sweltering Filipino summer, the last thing anyone wants is to fire up the oven and turn their kitchen into a sauna. Trust me, I've learned this lesson the hard way! But here's the good news – you can still satisfy your sweet tooth without breaking a sweat. Remember those childhood afternoons when Lola would whip up the most amazing desserts without even touching the stove? Those clever kitchen tricks are making a huge comeback, and I'm here to share some game-changing treats that'll keep you cool as a cucumber. Let's start with my absolute favorite – the Mango Graham Ice Box Cake. You'll need fresh mangoes (the sweeter, the better!), graham crackers, all-purpose cream, and condensed milk. Simply layer these ingredients in a container, pop it in the ref, and voilà! In just a few hours, you've got yourself a dessert that'll make your neighbors invite themselves over. But wait, there's more! For those days when you're craving something different, try the No-Bake Choco Peanut Butter Squares. Just mix crushed graham crackers with melted butter and peanut butter for the base, then top with a mixture of melted chocolate chips and more peanut butter. Easy peasy! Store it in the ref, and you've got instant happiness ready whenever the sugar cravings hit. Here's a pro tip: Keep these ingredients in your pantry, and you'll always be ready for surprise visitors or sudden dessert emergencies (yes, that's totally a thing!). Most of these treats can last up to a week in the refrigerator – though let's be honest, they rarely make it past day two in my house! The best part? You can get creative! Add some ube flavoring to your ice box cake, or throw in some cashews into your chocolate squares. There's no right or wrong way to make these treats your own. So the next time the mercury rises and your sweet tooth calls, remember: you don't need to suffer through a hot kitchen to enjoy something delicious. These no-bake wonders are here to save your day – and your electric bill! Now, who's ready to start making some magic in the kitchen? Just keep that ref running, and let's show this heat wave who's boss!""]",Food,PH,en
Mama's Secret Weapon: How Pancit Spaghetti Became Our Family's Midnight Craving,,"[""Growing up in a Filipino household, I've witnessed the magic that happens when our local flavors dance with international cuisine. And let me tell you about the dish that's been causing quite a stir in my family's kitchen – our very own Pancit Spaghetti! You know how Pinoys love their pancit and spaghetti, right? Well, imagine combining the best of both worlds! This fusion pasta creation started as a late-night experiment when Mama ran out of canton noodles but had a pack of spaghetti sitting in the pantry. What happened next became our family's most requested comfort food! The secret lies in treating your spaghetti noodles like pancit – toasting garlic until golden brown, sautéing shredded chicken (or tinapa if you're feeling adventurous!), and tossing in julienned carrots and cabbage. But here's where it gets interesting: instead of the usual pancit sauce, we're creating a hybrid sauce that combines calamansi, patis, and a touch of olive oil. Trust me, it works! Let me walk you through this game-changing recipe: First, get your pasta al dente – that's Italian for ""just right,"" but we're aiming for that pancit-like bite. While that's cooking, prepare your sawsawan-style sauce: mix calamansi juice, patis, black pepper, and a drizzle of olive oil in a bowl. This combination gives you that familiar pancit canton tang with an Italian twist! Next comes the fun part! In a large kawali (yes, forget the fancy pasta pot), sauté loads of garlic until fragrant. Add your protein – chicken, shrimp, or even chicharon bits for that extra Pinoy touch. Toss in your veggies, but remember: cut them pancit-style thin! Here's my pro tip: don't skip the final touch of toasted garlic bits and crushed chicharon on top. It's what makes this dish uniquely ours! And just like traditional pancit, a squeeze of fresh calamansi before serving makes all the difference. What started as Mama's kitchen emergency has become our go-to party dish. Whenever we serve it, there's always that moment of surprise when guests realize it's not quite pancit, not quite spaghetti, but something wonderfully in between! Remember, the best fusion dishes come from the heart – and sometimes, from an empty pancit canton shelf! So go ahead, give your spaghetti the Pinoy treatment. Who knows? It might just become your family's new favorite midnight craving too!""]",Food,PH,en
Lola's Kitchen Magic: Turn Yesterday's Rice into Today's Treasure,,"[""Growing up in a Filipino household, I learned early on that nothing goes to waste in the kitchen - especially not rice! My grandmother would often say, ""Sayang ang biyaya ng Diyos"" (Don't waste God's blessings), while transforming day-old rice into something spectacular. Let me share some of my favorite kitchen magic tricks that will make you think twice before tossing those leftovers! Trust me, these ideas are total game-changers for busy home cooks like you. First up is the classic sinangag (garlic fried rice) with a twist. Instead of just garlic, try sautéing leftover vegetables like carrots, bell peppers, or kangkong stems before adding your rice. The secret? Chop those veggies super fine - they'll blend right in, and your kids won't even notice they're eating their greens! Here's a cool trick I discovered: spread your leftover rice on a baking sheet and pop it in the fridge uncovered for an hour. This removes excess moisture, giving you the perfect base for crispy rice dishes. You can transform this into Filipino-style arancini by mixing in chopped longganisa and forming balls around cubes of cheese. Coat with breadcrumbs, fry until golden, and voilà - you've got a merienda that'll make your neighbors jealous! Got wilting vegetables? Don't throw them out! Those slightly soft carrots and limp celery are perfect for lugaw (rice porridge). Add them to your rice with some ginger and chicken stock, and you'll have a comforting bowl of goodness that tastes even better than when made with fresh ingredients. Here's my personal favorite: the ""Kitchen Sink"" Rice Balls. Mix your leftover rice with whatever vegetables you have on hand, add a beaten egg, form into balls, and pan-fry until crispy. I once made these with leftover adobo sauce, and my family still begs me to recreate that ""recipe""! Remember, the key to successful leftover makeovers is creativity and confidence. Don't be afraid to experiment - some of the best dishes come from happy accidents in the kitchen. Plus, you'll be doing your part for the planet while saving money. Now that's what I call a win-win situation! So, the next time you're about to toss that container of day-old rice or those forgotten vegetables at the bottom of your crisper, think again. With a little imagination and these tried-and-tested tips, you're all set to create something surprisingly delicious. Kain na! (Let's eat!)""]",Food,PH,en
Lola's Kitchen Secrets: The Hidden Stories Behind Our Evolving Family Favorites,,"[""In the heart of every Filipino home, there's a worn notebook filled with recipes, its pages stained with decades of soy sauce splashes and cooking oil marks. These cherished compilations tell more than just ingredient lists – they chronicle our families' journeys through time, adaptation, and reinvention. ""My grandmother's kare-kare used to take three days to prepare,"" recalls Chef Maria Santos of Manila's acclaimed Tahanan Restaurant. ""Now, my version captures the same flavors in three hours."" This evolution isn't just about convenience; it's a testament to how family recipes dance between tradition and innovation, adapting to modern life while preserving their soul. The transformation of these beloved dishes often begins subtly. A busy mother substitutes malunggay powder for fresh leaves in her tinola. A health-conscious daughter tweaks her father's legendary crispy pata recipe, air-frying instead of deep-frying. These modifications, born of necessity or innovation, gradually become the new normal for subsequent generations. Yet, something fascinating happens in this culinary evolution. Dr. Antonio Reyes, a food anthropologist at the University of the Philippines, observes, ""When recipes change, they often circle back to their roots in unexpected ways. Today's young professionals are actually more interested in learning their great-grandparents' original techniques than their parents were."" Take the case of the Garcia family's mechado. What began as a Spanish-influenced beef stew in their great-grandmother's kitchen transformed into a pressure-cooker version in the 1980s. Today, their grandson Jerome experiments with sous-vide cooking, ironically spending more time on the dish than his grandmother ever did – but with different reasons and results. The magic lies not in perfectly replicating the past, but in understanding how these recipes reflect our changing lives. Modern interpretations often carry surprising advantages: better nutrition, sustainable ingredients, or techniques that preserve flavors while adapting to contemporary constraints. ""The most successful family recipe adaptations,"" notes Chef Santos, ""are those that honor the dish's essence while acknowledging present realities."" It's not about choosing between tradition and innovation – it's about finding the sweet spot where both coexist. As we continue to adapt our culinary heritage, perhaps the most important ingredient remains unchanged: the stories we tell around these evolving dishes, ensuring that while the methods may shift, the memories and meanings endure for generations to come.""]",Food,PH,en
Sabaw Stories: How Your Lola's One-Pot Wisdom Can Save Your Weeknight Dinners,,"[""Remember those rainy afternoons when the aroma of simmering sinigang would fill your Lola's kitchen? There's something magical about how our grandmothers could transform simple ingredients into soul-warming meals using just one pot. Today, let's explore how this time-tested Filipino cooking wisdom isn't just nostalgia – it's the secret weapon for your modern kitchen struggles! I discovered this truth during my own cooking journey, when juggling deadlines meant either ordering takeout (again!) or finding a smarter way to cook. That's when I remembered how Lola would effortlessly create her legendary sinigang sa sampalok, letting the soup do all the work while she chatted with neighbors over the fence. The beauty of one-pot cooking lies in its brilliant simplicity. Take our beloved sinigang – you're not just making soup; you're creating layers of flavor as each ingredient adds its own special touch to the broth. Start with your sampalok base, add your pork (or bangus if you're feeling fishy!), then let your vegetables join the party one by one. The result? A perfectly balanced meal that practically made itself! But here's the exciting part – this ""sabaw wisdom"" extends beyond our shores! Every culture has its own one-pot wonders. The French have their coq au vin, while Moroccans swear by their tagine. Even Japan's nikujaga follows the same principle: throw everything in, let it simmer, and watch the magic happen. Want to try your hand at one-pot mastery? Here's your starter guide: 1. Layer your flavors: Start with aromatics (sibuyas, bawang – you know the drill!) 2. Time it right: Add ingredients based on cooking time (meat first, leafy veggies last) 3. Let it rest: Like any good story, these dishes get better with a little patience Pro tip: Keep some kangkong or pechay in your ref – they're perfect for adding last-minute nutrients to any one-pot creation! Remember, these dishes aren't just about convenience; they're about connection. Every bubble in that pot carries stories of family dinners, midnight cravings, and the comfort of home. So next time you're tempted to order delivery, channel your inner Lola instead. That one pot on your stove isn't just cooking dinner – it's keeping our culinary heritage alive, one delicious meal at a time! Now, excuse me while I check on my sinigang. The sampalok is calling, and like any good Filipino, I never keep my sabaw waiting! �""]",Food,PH,en
Fiesta-Ready in Five: Your Tita-Approved Guide to Stress-Free Party Prep,,"[""Let me tell you a secret that changed my Sunday family gatherings forever! As someone who grew up watching my grandmother juggle multiple dishes for our weekly family feasts, I've learned that the magic happens way before the first guest arrives. Remember those chaotic mornings when your kitchen looks like a tornado hit it, and you're still cooking when your titas start showing up? We've all been there! But here's the game-changer: strategic meal prep can turn you into the most relaxed host at your own party. First things first – let's talk about your BFFs (Best Food Friends): adobo, menudo, and mechado. These dishes actually taste better when made ahead! I discovered that adobo reaches peak flavor when it sits overnight, letting all those gorgeous vinegar and soy sauce notes really sink in. Pro tip: prep these saucy superstars 2-3 days ahead and store them in airtight containers. Just reheat and watch your guests fight over the last piece! Now, for your fresh items like ensaladang mangga or kinilaw, create your prep stations the night before. Chop your onions, tomatoes, and ginger, then store them separately. Trust me, your eyes will thank you for not crying over onions on party day! Keep your green mangoes whole until serving time to prevent oxidation – they're like nature's time capsules. Here's a trick my Tita Betty swears by: prep your rice in advance! Measure out your rice portions the night before and keep them ready in your rice cooker. When guests arrive, just hit that magic button, and you'll have perfectly steamed rice without the measuring drama. For desserts, bibingka and leche flan are your best friends. Make your leche flan up to two days ahead – it actually sets better with time! For bibingka batter, mix your dry ingredients ahead and combine with wet ingredients just before baking. The smell of fresh bibingka will make your guests feel extra special! Remember: a successful Filipino gathering isn't about proving you can cook everything on the same day. It's about sharing love through food while actually enjoying the company of your loved ones. So prep smart, prep early, and be present when your family arrives. After all, isn't that what our famous Filipino hospitality is all about? Want to be a kitchen ninja? Keep a ""party prep timeline"" on your phone. Start three days before, tackle one major dish each day, and watch how smoothly your next family gathering flows. Your relatives won't just praise your cooking – they'll wonder how you manage to look so fresh while hosting! Now, who's ready to transform their next family gathering from chaos to calm? Trust me, your future self will thank you for this!""]",Food,PH,en
Your Lola Would Never Believe These Meatless Miracles,,"[""Growing up in a Filipino household, the aroma of adobo simmering on the stove was as familiar as morning sunshine. But here's a secret that would make your grandmother do a double-take – those beloved classics you grew up with can be just as mouthwatering without meat! Let me share how I discovered this culinary revelation. After my tita switched to a plant-based diet for health reasons, I watched her transform our family's traditional recipes with ingenious substitutions that kept all the flavors we cherish. The magic? It's all in the mushrooms, tofu, and jackfruit! Take sisig, for instance. Who would have thought that chopped mushrooms, when seasoned with calamansi and chilis, could capture that same sizzling satisfaction we love? The secret is getting that perfect char on king oyster mushrooms before chopping them up – it creates that wonderful texture that makes sisig so addictive. And adobo? Oh, you're in for a treat! Extra-firm tofu, pressed and cut into chunks, soaks up that vinegar-soy sauce marinade even better than meat does. Pro tip: freeze your tofu first, then thaw it. This creates these amazing pockets that drink up all that sauce! Add whole black peppercorns and bay leaves, and you'll have your neighbors wondering what's cooking. Let's talk about kare-kare. Young jackfruit, when stewed in that rich peanut sauce with banana heart and eggplant, creates such a convincing version that even my meat-loving uncle asked for seconds. The trick is getting that sauce thick and creamy – use pure peanut butter, not the sweet commercial kind! Here's something I've learned along the way: Filipino cooking isn't really about the meat – it's about the interplay of sour, salty, and savory flavors that make our cuisine unique. When you focus on getting these elements right, the meat becomes secondary. Want to try this at home? Start with something simple like giniling using crumbled tofu or mushrooms. Season it exactly as you would the meat version, and you'll be amazed at how familiar it tastes. Remember, it's those banana ketchup, soy sauce, and garlic notes that make it taste like home. The best part? These plant-based versions are usually quicker to cook, easier on the budget, and leave you feeling lighter – but still absolutely satisfied. Plus, you're keeping our culinary traditions alive while giving them a modern, health-conscious twist. So go ahead, give these meatless makeovers a try. Your lola might raise an eyebrow at first, but once she tastes them, she might just ask you for the recipe!""]",Food,PH,en
The Secret Life of Your Lola's Rice: How Ancient Grains Tell Filipino Stories,,"[""In the misty terraces of Ifugao, where time seems to stand still, 82-year-old Maria Dulnuan gently runs her weathered fingers through a handful of rust-colored rice grains. ""This variety,"" she whispers, ""has been in our family for seven generations."" The rice she cradles isn't just any grain – it's Imbuucan, one of the Philippines' most treasured heirloom varieties, and it carries within its DNA the stories of countless Filipino ancestors. While modern supermarket shelves showcase perfectly polished white rice, a quiet revolution is stirring in the Philippine countryside. Traditional varieties like Ominio, with its distinctive purple-black kernels, and the aromatic Dinorado are making an unexpected comeback. These aren't just alternative food sources; they're living time capsules of Filipino cultural heritage. Dr. Elena Santos, a researcher at the Philippine Rice Research Institute, explains the phenomenon: ""Each heirloom variety is like a book written by our ancestors. Some are naturally flood-resistant, others thrive in drought – adaptations that took centuries to develop."" In her laboratory, she's documented over 300 heritage varieties, each with unique characteristics that modern hybrid rice simply can't match. Take the case of Mindoro's Lubang Red Rice, whose deep crimson grains have sustained fishing communities for generations. Local farmers swear it provides sustained energy for long days at sea – a claim now backed by nutritional studies showing its superior antioxidant content. ""Our great-grandparents knew what they were doing,"" chuckles Fernando Marcos, a third-generation Lubang rice farmer. ""They were scientists in their own right."" But these ancient grains face modern challenges. Climate change threatens traditional growing cycles, while commercial farming's promise of higher yields lures younger generations away from heritage varieties. Yet, a new wave of Filipino chefs and food entrepreneurs is creating unprecedented demand for these traditional grains. Chef Margarita Forés, known for championing Filipino cuisine globally, has incorporated black rice varieties into her contemporary dishes. ""These grains tell our story as Filipinos,"" she asserts. ""When you taste them, you're connecting with centuries of our culinary evolution."" For those interested in exploring these living links to our past, local farmers' markets increasingly feature heritage rice varieties. The key is to start small – perhaps with the nutty-flavored Ballatinaw from the Cordilleras or the aromatic Minaangan from Mindanao. Each grain carries not just nutrients, but narratives of the communities that have preserved them through generations. As sunset bathes the rice terraces in golden light, Maria Dulnuan shares one final wisdom: ""When you cook heritage rice, you're not just preparing a meal. You're continuing a story that began long before you and will continue long after."" In a world racing toward the future, these ancient grains remind us that sometimes, the most valuable treasures are the ones we've had all along.""]",Food,PH,en
Rescue Your Morning Routine: 5 Power-Packed Baon That Prep in a Flash!,,"[""Stuck in the daily grind of Manila traffic and back-to-back meetings? I feel you! As someone who practically lives in BGC's concrete jungle, I've mastered the art of preparing baon that's both masarap and mabilis. Let me share my secret weapons for winning the breakfast battle! Gone are the days of sad sandwich lunches or expensive food delivery. These power-packed baon ideas will revolutionize your workday fuel – and the best part? You can whip them up while your coffee is still brewing! First up: The Overnight Wonder Remember those mason jars collecting dust in your kitchen? Put them to work! Layer rolled oats, your favorite yogurt (I'm partial to local mango!), chia seeds, and seasonal fruits the night before. By morning, you'll have a protein-rich breakfast that looks Instagram-worthy. Pro tip: Keep those mangoes at the bottom to prevent soggy oats! The Rice Bowl Revolution Transform last night's leftover rice into a game-changer! Sauté pre-chopped vegetables (I prep these during Sunday marketing), crack an egg, dash of sesame oil, and voilà – your homemade Korean-inspired rice bowl is ready in 7 minutes flat. Tip: Store pre-portioned vegetables in reusable containers for grab-and-go prep. The Ultimate Wrap Attack Who says healthy can't be exciting? Prepare whole wheat tortillas filled with tuna (or chicken), shredded carrots, lettuce, and a dollop of homemade yogurt dressing. Roll them up in aluminum foil, and they're ready to join you in those marathon meetings! Smart Snack Boxes Channel your inner tita with compartmentalized containers! Fill them with cut fruits, nuts, whole grain crackers, and cheese cubes. It's like having your own personal pantry at work, minus the guilt of reaching for those vending machine chips! The 3-Minute Protein Powerhouse Hard-boiled eggs are your best friends! Boil a batch on Sunday, and you're set for the week. Pair them with cherry tomatoes, cucumber sticks, and whole grain bread for a complete meal that assembles faster than you can say ""traffic sa EDSA!"" Remember, the key to successful baon prep is working smarter, not harder. Keep your pantry stocked with basics, invest in good containers (those with leak-proof lids are worth every peso!), and embrace the weekend prep routine. Your future self will thank you when you're enjoying these delicious, healthy meals while your officemates are still waiting for their food delivery! Ready to transform your lunch game? Time to raid that pantry and show your workweek who's boss!""]",Food,PH,en
