title,description,content,category,country,language
Beyond Pills: Why Your Body Already Knows How to Beat Pain,,"[""In a small clinic in Makati, Dr. Maria Santos watches as her patient, 45-year-old call center agent Rica Domingo, performs gentle stretching exercises. ""Six months ago, I couldn't even sit for an hour without back pain,"" Rica shares, her face brightening. ""Now, I rarely reach for painkillers."" Rica's journey reflects a growing understanding among Filipino health professionals: our bodies possess inherent pain-prevention mechanisms that, when properly activated, can work better than conventional treatments alone. ""We're moving away from the 'take a pill and rest' mindset,"" explains Dr. Santos, who specializes in integrative medicine. ""The body has sophisticated systems for preventing and managing pain – we just need to learn how to support them."" Research from the Philippine Journal of Internal Medicine reveals that 68% of office workers experience chronic pain, yet many are unaware of their body's natural pain-fighting capabilities. Here's how to activate your internal pain prevention system: Movement as Medicine Studies show that regular movement stimulates the production of natural pain-blocking compounds. ""Think of movement like turning on your body's own pharmacy,"" says physical therapist Paolo Reyes. Simple activities like morning stretching or traditional Filipino folk dancing can activate these mechanisms. The Mind-Body Connection Ancient healing practices, deeply rooted in Filipino culture, have long recognized the power of mental wellness in pain prevention. Modern science now confirms this wisdom: stress reduction techniques can lower inflammation markers by up to 15%. Nutrition as Prevention ""Many Filipinos don't realize that their ulam choices directly impact their pain levels,"" notes nutritionist Dr. Anna Lim. Anti-inflammatory foods like malunggay, ginger, and turmeric – staples in Filipino cuisine – can significantly reduce pain vulnerability. Sleep: Your Natural Reset Button Quality sleep allows your body to repair and strengthen its pain prevention systems. Traditional practices like drinking warm ginger tea before bedtime aren't just comforting – they're scientifically sound approaches to pain management. Rica's success story isn't unique. By embracing these holistic approaches, many Filipinos are discovering that the best pain prevention strategy might not be in their medicine cabinet – but within themselves. Remember: while these natural approaches are powerful, always consult healthcare professionals for persistent pain issues. The goal is to work with, not against, your body's innate wisdom in preventing and managing pain.""]",Health,PH,en
Live Like You're 100: Ancient Secrets from the World's Healthiest Villages,,"[""In a humble kitchen in Okinawa, 98-year-old Masako tends to her garden before dawn, her weathered hands expertly picking fresh herbs for her morning tea. Half a world away in Sardinia, 95-year-old Giuseppe herds sheep across sun-drenched hills, just as his ancestors did for generations. These aren't outliers – they represent thriving communities where reaching 90 or 100 is remarkably common. Welcome to the Blue Zones, extraordinary pockets of longevity that have captured scientists' attention worldwide. But what makes these regions special isn't just their residents' impressive lifespans – it's how vibrantly they live every day. ""The secret isn't in some exotic supplement or strict diet,"" explains Dr. Maria Santos, a longevity researcher at the University of the Philippines. ""It's their entire lifestyle ecosystem that promotes health and vitality."" Let's unlock their time-tested wisdom: The Power of 'Hara Hachi Bu' Okinawans practice this ancient principle of eating until you're 80% full. ""It's similar to our Filipino value of 'tama lang' – just enough,"" notes Dr. Santos. This natural portion control helps maintain a healthy weight without strict dieting. Move Naturally, Move Often Forget intense gym sessions. Blue Zone residents stay active through daily life – walking to markets, tending gardens, or dancing with friends. ""It's about making movement a natural part of your day, like our ancestors did,"" explains wellness expert Juan Reyes. The Strength of 'Tribe' Much like our Filipino concept of 'bayanihan,' Blue Zone communities prioritize social connections. Regular family gatherings, community celebrations, and strong support networks contribute significantly to their longevity. Plant-Slant Your Plate While not strictly vegetarian, these communities eat mostly plant-based foods. ""Their diet closely resembles our traditional Filipino eating patterns before the fast-food era,"" observes nutritionist Ana Tan. Beans, vegetables, and whole grains form the foundation of their meals. Purpose Beyond Retirement In Okinawa, they call it ""ikigai"" – a reason for being. Whether it's caring for grandchildren, maintaining community gardens, or sharing traditional crafts, having purpose drives Blue Zone residents to stay active and engaged well into their 90s. The beauty of these longevity practices lies in their simplicity and accessibility. You don't need expensive equipment or exotic ingredients – just a return to time-tested wisdom that our ancestors understood intuitively. As we navigate our modern lives in the Philippines, these lessons from the Blue Zones remind us that the path to a longer, healthier life might be simpler than we think. It's about creating an environment where healthy choices become natural choices, where community supports wellbeing, and where age is just a number. After all, as the saying goes in Okinawa, ""At 70, you are still a child."" Perhaps it's time we embraced their perspective and started living like we're meant to reach 100 – with vitality, purpose, and joy.""]",Health,PH,en
Balik-Kamay: How Grandma's Eating Style Could Be Your Wellness Game-Changer,,"[""Remember those Sunday lunches at Lola's house, where everyone gathered around banana leaves, eating with their hands? That cherished Filipino tradition might just be the key to transforming your relationship with food. Welcome to a modern twist on our ancestral way of eating that's making waves in the wellness world. ""Eating with your hands connects you to your food in ways a fork never could,"" says Manila-based nutritionist Dr. Maria Santos. This intimate connection is exactly what inspired our week-long challenge that's helping Pinoys rediscover mindful eating through our traditional kamayan style – but with a clean eating twist. The concept is beautifully simple: seven days of unprocessed, whole foods, eaten traditionally with your hands. No fancy implements, just you, your food, and your heightened awareness of every bite. It's about slowing down, feeling the texture of your brown rice, sensing the warmth of your ginisang monggo, and truly appreciating your ulam. Here's your day-by-day guide to this transformative experience: Day 1: The Reset Start with familiar favorites like steamed fish and fresh vegetables. The key is to pause before each bite, feeling the temperature and texture with your fingers. Many participants report eating 30% less simply because they're more mindful of their portions. Days 2-3: The Connection Replace processed snacks with fresh fruits and nuts. When you handle food directly, you naturally become more selective about what you eat. As Makati-based participant Juan dela Cruz shares, ""I started thinking twice about junk food when I had to touch everything I ate."" Days 4-5: The Revelation Introduce more traditional Filipino vegetables like malunggay and gabi leaves. Eating with your hands naturally slows you down, improving digestion and helping you recognize fullness signals earlier. Days 6-7: The Integration By now, you'll notice how this practice transforms your relationship with food. Participants report better portion control, improved digestion, and a deeper appreciation for their meals. Tips for Success: - Wash hands thoroughly before and after meals - Prepare fresh, unprocessed ingredients - Set up your eating space with banana leaves for authenticity - Practice proper kamayan technique: use your right hand, keep your fingers together - Listen to your body's hunger and fullness cues Beyond clean eating, this challenge reconnects us with our cultural heritage. As Tita Beth from Cebu observed, ""It reminded me of how my parents taught me to eat – with respect for the food and gratitude for each meal."" Ready to transform your eating habits while honoring our traditions? This week-long journey might just be your path to a healthier relationship with food, one handful at a time. Kain na!""]",Health,PH,en
Barangay Bodybuilding: Your Living Room is Now a Gym,,"[""Remember when Tita Susan from next door thought you were possessed after seeing you do jumping jacks through your window? Welcome to the new normal of Filipino fitness, where our bahay-bahay workouts are becoming as common as morning pandesal. Let's face it – between Manila traffic and endless Zoom meetings, finding time for the gym feels like searching for parking at SM on a weekend. But here's the good news: your living room, no matter how cozy, can be your personal fitness studio. And no, you don't need to turn your space into a mini Anytime Fitness. Start with what we'll call the ""Pinoy Power Trinity."" First, transform your trusty water gallons into weights – those 5-liter containers aren't just for storing tubig anymore! Second, your banig or yoga mat becomes your exercise best friend. Third, that sturdy monobloc chair isn't just for merienda – it's your new workout partner for step-ups and modified push-ups. Here's a 20-minute routine that fits perfectly between your morning kape and first virtual meeting: • Galon Gains: 3 sets of 12 water container lifts • Bahay Burpees: 10 modified burpees (yes, your neighbors won't hear a thing!) • Pinoy Planks: Hold for 30 seconds while mentally reciting your favorite Filipino proverbs • Monobloc Magic: 15 chair squats ""Pero paano kung mainit?"" No worries! Early morning or evening sessions work best. Keep your electric fan on full blast, or as we say, ""todo paypay mode."" Remember to hydrate like you're drinking your favorite sago't gulaman – regularly and enthusiastically. The best part? These workouts cost less than your weekly milk tea budget. Plus, you're always just a few steps away from your shower and that important Viber meeting. No more excuses about traffic or parking! Ready to level up? Create your own ""Home Workout Playlist"" featuring your favorite OPM hits. Nothing beats doing squats to ""Magbalik"" or planking to ""Kilometro."" Remember, fitness isn't about transforming into the next Brandon Vera overnight. It's about finding what works for you, in your space, on your schedule. As we say in Filipino, ""Unti-unti, basta tuloy-tuloy."" So tomorrow morning, instead of hitting that snooze button, grab your galon weights and start moving. Your body will thank you, and who knows? You might just inspire Tita Susan to join in too!""]",Health,PH,en
"Tiny Space, Big Flavors: Your Condo's Hidden Restaurant",,"[""Living in Metro Manila's concrete jungle doesn't mean you have to rely on takeout forever. Picture this: fresh basil from your window box perfuming your morning coffee, plump cherry tomatoes ripening on your balcony, and crisp lettuce growing right in your kitchen. Sound impossible? Think again! More urban Pinoys are discovering the joy of ""pocketside farming"" – turning tiny spaces into thriving food gardens. Take Anna Santos, a BPO professional in Makati, who transformed her 3-square-meter balcony into a mini vegetable paradise. ""I used to spend ₱500 weekly on herbs alone,"" she shares. ""Now I just step outside and snip what I need."" The secret? Going vertical. Those bare walls aren't just for family photos anymore. Try these space-smart solutions: Bottle gardens are your new best friend. Those empty San Miguel bottles? Clean them, lay them horizontally on mounted racks, and you've got perfect planters for herbs like oregano and wansoy. The natural Filipino ""diskarte"" at work! Transform old rice sacks into hanging gardens. Cut pockets into the sides, fill with soil, and voilà – instant vertical garden! Perfect for pechay, mustasa, and other leafy greens that remind you of Lola's garden. Your kitchen scraps are garden gold. That malunggay you bought last week? Save the stems! Many Filipino vegetables easily grow from cuttings. Alugbati, kamote tops, and spring onions will regrow from their bases – it's like getting free vegetables! Light matters, but don't worry if your space isn't sun-soaked. Many herbs and vegetables, like peppermint and kangkong, thrive in partial shade. Even your air-conditioned living room can become a growing space with the right LED grow lights. The best part? Your homegrown produce isn't just cheaper – it's safer. You control what goes into your soil and onto your plants. No mysterious chemicals, just pure, healthy goodness. Ready to start? Begin small. A few pots of basic herbs like basil and oregano can transform your daily cooking. As your confidence grows, so can your garden. Before you know it, you'll be hosting dinners where ""farm-to-table"" means ""balcony-to-bowl."" Remember: every great garden starts with a single pot. Your urban jungle feast awaits!""]",Health,PH,en
Wake Up Like A Modern-Day Healer: Your 15-Minute Ritual To Pinoy-Style Zen,,"[""In the bustling streets of Metro Manila, where jeepneys honk and street vendors call out their morning greetings, finding peace can feel like searching for a pearl in the Pasig River. Yet, our ancestors knew something we're slowly rediscovering – mornings aren't just for rushing to beat the traffic; they're sacred moments for self-care. Picture this: Your lola brewing salabat while practicing deep breathing, next to your sister doing yoga with her phone propped up against the rice cooker. It's not an unusual sight anymore, as more Filipinos embrace this beautiful dance between traditional wellness and modern mindfulness practices. The Magic Morning Mix Start with what our elders swear by – a warm glass of calamansi juice or salabat. While the kettle boils, try this contemporary twist: instead of immediately checking social media, spend three minutes doing mindful breathing. Inhale the familiar morning scents of your home – perhaps your neighbor's freshly baked pandesal or blooming sampaguita. Next, combine the age-old practice of morning stretching with gentle yoga poses. Our grandparents naturally did this when they swept their yards at dawn, but now we can enhance these movements with purposeful intention. Try the ""Magandang Umaga"" stretch – raising your arms to the sky while greeting the sun, just as our elders did while tending to their morning gardens. The Digital-Traditional Balance Here's where modern meets traditional: Use your smartphone's timer for a 5-minute meditation, but face your garden or window instead of your screen. Many young professionals in Makati and BGC are creating these ""hybrid rituals"" – perhaps burning traditional palo santo while using meditation apps, or saying traditional prayers while using crystal singing bowls. Making It Work For You Remember, this isn't about perfectly replicating a wellness influencer's routine. It's about finding your own rhythm, like creating a morning playlist that mixes traditional Filipino instrumental music with contemporary lo-fi beats. Some days, your ritual might be as simple as mindfully sipping your coffee while watching the sunrise from your condo balcony. The key is consistency with compassion. Start small – perhaps with just five minutes of intentional morning time. As we say in Filipino, ""Unti-unti lang"" (little by little). Your morning ritual should feel like a gentle embrace, not another task on your to-do list. In a world where we're constantly torn between traditional values and modern pressures, these morning moments become our sanctuary. They're where we can honor both our roots and our contemporary lives, creating a wellness practice that's uniquely ours – uniquely Filipino. Remember, as you step out into the morning rush, that peace isn't found in perfectly executed rituals, but in the mindful moments we create for ourselves. Whether you're in a humble apartment in Quezon City or a high-rise in Bonifacio Global City, your morning ritual is your personal revolution – your way of saying ""Magandang umaga"" to yourself first, before facing the world.""]",Health,PH,en
Unplug and Unleash: Your 48-Hour Freedom from Phone Prison,,"[""Remember when weekends meant catching up with friends over coffee, not catching up on endless social media feeds? In today's hyper-connected Manila, where smartphones seem like extensions of our hands, taking a digital break isn't just refreshing – it's revolutionary. Picture this: You're at a family gathering, but instead of truly connecting with Tita Ellen's heartwarming stories, you're mindlessly scrolling through your feed. Sound familiar? You're not alone. Studies show the average Filipino spends over 10 hours daily on digital devices – that's more time than we spend sleeping! But here's your chance to break free. Your ultimate weekend digital detox adventure starts now, and it's easier than you think. Let's turn that ""always online"" status to ""present in real life."" Start Small, Win Big Begin your Saturday morning by replacing your usual phone alarm with a traditional clock. Instead of reaching for your phone, reach for your favorite taho vendor's breakfast treat. Feel the morning sun on your face rather than the blue light on your screen. Create No-Phone Zones Transform your dining table into a device-free sanctuary. Replace Instagram food shots with actual conversations. Remember those? Make mealtime sacred again, just like how our lolos and lolas did it. The family stories you'll hear might be better than any viral video. Rediscover Analog Joy Pull out those dusty board games – that old Scrabble set or Monopoly board hiding in your cabinet. Visit your local park in Makati or BGC. Write in an actual journal (yes, with pen and paper!). The satisfaction of physically crossing out items on your to-do list beats any digital checklist. Emergency Protocol For those ""what if"" moments, designate one household landline for urgent calls. Let close family know you're doing a digital detox – they'll probably admire your initiative. Remember, our parents managed just fine without smartphones in the '90s! The Comeback Strategy When Sunday evening arrives, don't dive back into the digital world all at once. Check messages mindfully, set new boundaries for app usage, and maintain some of your newfound offline habits. Your mental health deserves this break. As we say in Filipino, ""Hinay-hinay lang"" – take it easy. This weekend might just be the reset button you didn't know you needed. Ready to reclaim your real life from your virtual one? Remember: Your notifications will wait, but life's precious moments won't. Make this weekend count – screen-free and soul-full.""]",Health,PH,en
Healing from Lola's Garden: Ancient Filipino Secrets to Modern-Day Peace,,"[""In the heart of every Filipino home, there's often a small garden where healing grows alongside memories. My grandmother's backyard paradise wasn't just a collection of plants – it was her personal pharmacy, filled with nature's stress-busting solutions that our ancestors have trusted for generations. Take the humble sambong, those aromatic leaves that dance in the afternoon breeze. While most know it for treating coughs, this versatile herb also works wonders for anxiety when brewed into a calming tea. ""Inom muna tayo ng tsaa,"" Lola would say, her gentle reminder that sometimes the best medicine is simply taking a moment to breathe. But it's not just sambong that carries these stress-melting properties. The purple-flowered banaba, traditionally known for managing diabetes, doubles as a natural relaxant. A few leaves steeped in hot water create a soothing drink that rivals any imported stress-relief tea. Meanwhile, peppermint, which grows abundantly in local gardens, offers both aromatherapy benefits and a refreshing brew that can ease tension headaches. What makes these local remedies particularly special is their accessibility. Unlike expensive supplements or fancy wellness treatments, these plants often grow right in our neighborhoods or can be found in local markets for just a few pesos. The act of tending to these herbs itself becomes a form of stress relief – there's something deeply grounding about having your hands in the soil, nurturing plants that will later nurture you. Here's a quick guide to starting your own stress-relief garden: - Plant sambong in partial shade - Give banaba plenty of sunshine - Keep peppermint in a contained area as it spreads quickly - Water regularly, especially during the dry season Beyond their medicinal properties, these plants connect us to our heritage. Every time we brew these traditional remedies, we're not just fighting stress – we're keeping alive the wisdom that our lolos and lolas passed down through generations. Remember, while these natural solutions are powerful allies in stress management, they work best as part of a holistic approach that includes proper rest, regular exercise, and a balanced diet. As my Lola always said, ""Kalusugan ay kayamanan"" – health is wealth. Why not start your own healing garden today? Your future self will thank you for this green investment in peace and wellness.""]",Health,PH,en
From Fishball to Fab: Your Street Food Glow-Up Guide,,"[""Picture this: It's 3 PM, your stomach is grumbling, and that familiar street food cart is calling your name. We've all been there – caught between the tempting aroma of kwek-kwek and our promise to eat healthier. But what if I told you there's a way to enjoy your favorite street eats without the guilt trip? Let's get real – street food is part of our Pinoy DNA. It's where we gather, gossip, and grab a quick bite between meetings or merienda time. The good news? You don't have to break up with your beloved street food favorites. You just need to know the tricks of the trade. First up, let's talk about smart swaps. Instead of the traditional oil-soaked fishball, seek out vendors who offer grilled fish skewers or tokwa't baboy with more tokwa than baboy. These protein-packed alternatives give you the same satisfaction with less of the grease. Pro tip: Look for carts that change their cooking oil regularly – your taste buds and tummy will thank you! Craving something with a crunch? Skip the deep-fried isaw and go for fresh lumpia. It's packed with vegetables and wrapped in delicate rice paper, giving you fiber and nutrients without the extra oil. Many modern street food vendors now offer brown rice siomai or malunggay pandesal – small tweaks that make a big difference. Here's a game-changer: timing matters. Hit the streets when vendors are setting up fresh batches. Food sitting out for hours isn't just less appetizing – it's less healthy too. And don't forget your BFF (Best Food Friend): suka! This vinegar-based condiment isn't just for flavor; it's known to help kill harmful bacteria. Remember those green papaya atchara you usually ignore? Load up on these fiber-rich sides. They're not just pretty garnishes – they're your digestive system's secret weapon. And when it comes to drinks, swap out sugar-loaded sago't gulaman for fresh buko juice or lemon water from nearby vendors. The street food scene is evolving, and health-conscious options are popping up everywhere. From vegetable okoy to mushroom sisig, vendors are getting creative with healthier ingredients. Support these innovative sellers – they're the future of our beloved street food culture. Your street food journey doesn't have to be an either-or situation. It's about making smarter choices while still enjoying the vibrant flavors of our culture. So next time you hear that familiar ""Taho!"" call in the morning, know that you can still indulge – just maybe opt for the sugar-free version!""]",Health,PH,en
