title,description,content,category,country,language
Where Wild Peaks Whisper: My 7-Day Dance with the Mountain Spirits,,"[""The morning fog parts like a ethereal curtain as I shoulder my pack at the base of Mt. Pulag, the first stop on what would become my most transformative journey through the Cordillera's ancient spine. The locals call these peaks the playground of the gods, and over the next week, I would understand why. Day one greets us with mossy forests dripping with morning dew, their twisted branches forming natural archways as if welcoming pilgrims to a sacred realm. My guide, Manuel, a Kalinga native whose ancestors have traversed these paths for generations, points out wild orchids that bloom only in these heights. ""The mountains,"" he says with a knowing smile, ""they choose who they welcome."" The route unfolds like a story written in stone and soil. From Pulag's grasslands, we thread our way north through Kalinga's rice terraces, each step revealing how the indigenous peoples have danced with these slopes for millennia. The ancient walls, still standing proud, tell tales of engineering wisdom that predates modern civilization. By day three, we're deep in Sagada territory, where pine forests whisper secrets to those who listen. The trail here demands respect - steep switchbacks and narrow ridges that test both nerve and muscle. But the rewards are beyond mere words: sunset from Marlboro Country sets the clouds ablaze with colors I never knew existed in nature. Our fourth and fifth days take us through the heart of Bakun, where rivers born from mountain springs become our constant companions. The locals share their homes and stories, teaching us how to cook native mountain rice in bamboo tubes - a technique that makes every meal taste like it's blessed by the forest itself. The final stretch through Mt. Amuyao challenges everything we think we know about endurance. The altitude thins both air and ego, but as we reach the summit on day seven, the entire Cordillera range spreads before us like a crumpled blanket of green and gold, making every blister and aching muscle worth it. For those brave enough to follow this path, here's your essential guide: - Best Season: October to February - Required Permits: Local tourism offices in Kabayan, Sagada, and Bakun - Must-Pack: Thermal wear, rain gear, trek poles, and most importantly, humility before the mountains - Recommended Duration: 7-8 days minimum - Guide Requirement: Mandatory local guides for each region Remember, the Cordillera isn't just a mountain range - it's a living museum of Philippine heritage, where every trail tells a story, and every peak guards a secret. Come prepared not just for a physical journey, but for a spiritual one that will reshape your understanding of our connection to the land. The mountains are calling, kabayan. Will you answer?""]",Travel,PH,en
Dance with the Durian: My 7-Day Love Affair with the Wild Side of Palawan,,"[""The first thing that hits you isn't the heat – it's the symphony. A thousand invisible creatures orchestrating their morning ritual as I step into Mount Mantalingahan's protected landscape. My guide, Kuya Ramon, grins knowingly. ""The forest is welcoming you,"" he says, adjusting the rattan basket strapped to his back. I've hiked countless trails before, but nothing prepared me for the raw intensity of a Philippine tropical forest. Here, survival isn't just about having the right gear – it's about reading the jungle's ancient language. Within hours, I learn my first lesson: the liyang ant's march across a trail isn't random; it's nature's barometer. ""When they climb higher ground,"" Kuya Ramon whispers, ""expect rain within the hour."" The forest speaks in other ways too. The distinctive scratch marks on tree trunks become my compass – sun bears mark their territory on the eastern sides of trees, offering direction when the thick canopy obscures the sun. I watch Kuya Ramon gently bend a palm frond, creating an instant water collector. ""Nature provides,"" he says, ""but you must know how to ask."" As dusk approaches, we establish camp near a clearing. The art of shelter-building here is nothing like what survival books teach. Kuya Ramon demonstrates the indigenous ""elevated A-frame"" technique, using bamboo and wild banana leaves. ""Keep your feet off the ground,"" he explains. ""The forest floor comes alive at night."" Perhaps the most valuable lesson comes on day five when we lose our trail after a sudden downpour. Instead of panic, Kuya Ramon teaches me to listen for running water – streams here inevitably lead to villages. We follow the sound, but not before harvesting some wild ginger and rattan shoots. ""In the forest,"" he grins, ""getting lost sometimes means finding dinner."" By day seven, I've learned to read this green maze like a book. The peculiar bend of a fern might signal a hidden spring. The sweet scent of overripe durian could mean either a feast or a warning of wildlife activity. Every detail matters, every sense engaged. As we descend back to civilization, I realize the most crucial survival skill isn't about techniques or tools. It's about humility – understanding that we're guests in this ancient realm. The forest doesn't bend to our will; we learn to dance with it, following its lead in an age-old waltz of survival. For those venturing into these emerald depths, remember: your best compass is respect, your finest shelter is knowledge, and your greatest ally is patience. The forest will teach you – if you're willing to listen.""]",Travel,PH,en
Paradise Whispers: Where Ancient Maps Lead to Blue Dreams,,"[""The old fisherman's eyes crinkled as he traced invisible lines across the horizon, his weathered finger pointing toward what seemed like endless blue. ""Doon,"" he whispered, using the Tagalog word for ""there,"" indicating a hidden passage between two towering limestone cliffs that I would have missed entirely. Here in the Philippine archipelago's lesser-known corners, between Palawan and Mindoro, lies a labyrinth of secret passages and forgotten coves that even Google Maps hasn't fully captured. Armed with nothing but local wisdom and a dog-eared notebook filled with hastily scribbled directions from village elders, I've spent the last week chasing whispers of paradise. The journey begins at dawn, when the bangkeros (local boatmen) prep their vessels with an almost ceremonial precision. We glide past tourist-heavy spots, our small wooden boat banking left where most go right. The morning sun catches the spray of saltwater, creating tiny rainbows that dance across the bow – nature's own light show guiding our way. Through a narrow channel barely wide enough for our boat, we emerge into what the locals call ""Himbing Cove"" – a pocket of tranquility where the water shifts from deep cobalt to crystal clear turquoise so suddenly it seems almost engineered. Towering karst formations create a natural amphitheater, their faces etched with centuries of wind and wave action, telling silent stories of geological time. But the real magic lies beneath. Slipping into the water, I discover an underwater garden that few have witnessed. Brain coral formations pulse with life, while schools of yellow-striped sweetlips dart between ancient sea fans. A sea turtle, unbothered by our presence, glides past with aristocratic grace. As we island-hop through this hidden archipelago, each stop reveals its own secrets. There's a beach where the sand shifts from white to pink as the sun sets, and a hidden lagoon accessed only through a submarine cave during low tide – a journey that requires precise timing and more than a little courage. What strikes me most is the absence of the usual trappings of tourist spots. No vendors selling cold drinks, no rental umbrellas, not even a single piece of plastic waste marring the pristine shores. These places remain pure, protected by their obscurity and the guardianship of local communities who understand their true value. The day ends at what the fisherman calls ""Huling Pahinga"" (Last Rest), a crescent-shaped beach where the sunset ignites the sky in impossible shades of purple and gold. As darkness falls, bioluminescent plankton begin their nightly dance, turning the gentle waves into streams of living light. These hidden paradises still exist, tucked away in the folds of our archipelago. They remind us that sometimes the most extraordinary discoveries lie just beyond the beaten path, waiting for those willing to trust in ancient knowledge and brave enough to venture into the unknown. For those seeking their own blue dreams, remember: the best maps are often drawn in stories, passed down through generations, waiting to be heard by those who listen closely enough.""]",Travel,PH,en
Into the Dark Heart of Sagada: A Spelunker's Love Letter,,"[""The first drop of cold water hits my neck unexpectedly, sending a shiver down my spine. Here, 50 meters beneath Sagada's pine-covered surface, the darkness wraps around me like a familiar blanket. I've explored caves across Southeast Asia, but nothing quite prepares you for the raw, primal beauty of Sagada's underground realm. ""Mag-ingat ka,"" whispers Mario, my local guide, his headlamp cutting through the darkness. ""The ancestors still walk these passages."" His words echo off limestone walls that have been shaped by water and time for millions of years, creating nature's own cathedral. We're deep inside Sumaguing Cave, locally known as the ""Big Cave,"" though that modest name barely does justice to this underground labyrinth. Massive chambers open up before us, their ceilings disappearing into the darkness above. Ancient stalactites hang like frozen waterfalls, while stalagmites rise from the ground like nature's skyscrapers, each one a testament to centuries of patient mineral deposits. The journey here isn't for the faint-hearted. We scrambled down slick rock faces, waded through underground streams, and squeezed through passages barely wider than my shoulders. But each challenge reveals new wonders: crystalline formations that sparkle like diamonds under our lights, underground pools so clear they seem like mirrors, and rock formations that local legends say represent everything from dancing giants to sleeping dragons. What makes Sagada's caves unique isn't just their geological splendor – it's their cultural significance. These caverns once served as burial grounds for the indigenous Igorot people, who believed in bringing their dead closer to the earth's heart. While the burial caves are separate and sacred, their presence adds a profound spiritual dimension to every underground journey here. The air grows thinner as we descend deeper, but Mario's stories keep my mind off the challenging conditions. He points out formations with names like ""King's Curtain"" and ""Chocolate Hall,"" each with its own tale woven into the fabric of local folklore. His grandfather first explored these passages with nothing but pine resin torches, mapping the underground maze through memory and intuition. As we emerge hours later, blinking in the mountain sunlight, I'm changed. Sagada's caves aren't just geological wonders – they're time capsules, cultural treasures, and adventure playgrounds rolled into one. They remind us that sometimes the most extraordinary discoveries lie not in scaling mountains, but in venturing beneath them. For those brave enough to follow in our footsteps, remember: respect the caves as you would a sacred temple, bring an experienced guide, and prepare to be humbled by the sheer magnificence of nature's underground architecture. Sagada's caves await, ready to share their secrets with those willing to embrace the darkness.""]",Travel,PH,en
Pedal Paradise: Your Ultimate Guide to Luzon's Hidden Two-Wheel Treasures,,"[""As I grip my handlebars at dawn, watching the sun peek through Batangas' coffee-laden hills, I can't help but smile at the adventure ahead. The Philippines' mountain biking scene has exploded in recent years, and I'm about to share why the trails between Batangas and Zambales have become the holy grail for both weekend warriors and serious riders alike. My wheels first crunch through the volcanic soil of Batangas' Taal Heritage Trail, where centuries-old kapok trees stand sentinel over single tracks that weave through coffee plantations. The morning air carries the scent of arabica, and local farmers wave as I navigate the technical descent that locals playfully call ""Kape Kaladkarin"" – a nod to both the surrounding coffee trees and the way it tends to drag riders through its challenging terrain. Moving northward, the landscape transforms dramatically at the legendary Crow Valley trails in Zambales. Here, the lahar-covered paths tell stories of Mt. Pinatubo's fury, creating what many riders consider nature's perfect pump track. The volcanic ash has settled into rhythmic waves that feel like riding ocean swells frozen in time. ""It's like surfing on dirt,"" explains Mang Roger, a local guide who's been riding these trails for two decades. But it's not just about the riding. Each stop along this north-south corridor offers its own flavor of Filipino trail culture. In Subic, former military paths have been repurposed into flowing single tracks where macaques watch curiously from overhead branches. The nearby Sierra Madre foothills offer technical climbs that test both lungs and spirit, rewarding persistent riders with views of the West Philippine Sea that steal what little breath remains. For those ready to tackle these trails, here's your essential starter pack: Begin with the novice-friendly Batangas Brew Loop, a 15-kilometer circuit that connects three local coffee farms. Progress to the intermediate Zambales Lahar Lines, but save the infamous ""Alas ng Agila"" trail for when your skills – and courage – have matured. Remember to respect local protocols; many trails cross private property where access has been graciously granted to the biking community. The best times to ride are during the amihan season (November to February), when the northeast monsoon brings cooler temperatures and tacky trail conditions. Local bike shops in major towns offer rentals and repairs, but always carry basic tools and plenty of water – the tropical sun shows no mercy to unprepared riders. As I end my journey watching the sunset paint Zambales' lahar fields in golden hues, I realize these trails offer more than just world-class riding – they're a testament to how nature's most dramatic transformations can create unexpected playgrounds for those willing to explore on two wheels. Whether you're a seasoned rider or just starting out, these trails between Batangas and Zambales aren't just paths through the landscape – they're passages through the heart of Philippine mountain biking culture. So grab your bike, find your gear, and discover why this region has become the worst-kept secret in Southeast Asian mountain biking.""]",Travel,PH,en
Beyond the Tourist Trail: 7 Hidden Waterfalls That Whisper Ancient Filipino Secrets,,"[""The morning mist clings to my skin as I push through a curtain of emerald vines, following nothing but the distant thunder of falling water and my local guide's confident footsteps. We're three hours deep into the heart of Biliran's untamed wilderness, far from the Instagram-famous cascades that flood social media feeds. ""The old folks say Bagongbong Falls only reveals itself to those who respect the forest,"" whispers Manuel, my guide of 15 years, as we pause to listen to the distinctive call of a Philippine Eagle. The air grows heavier with moisture, carrying the sweet scent of wild orchids and the earthy aroma of moss-covered stones. Unlike its famous cousins – Pagsanjan or Kawasan – Bagongbong remains a secret whispered among local communities. Its 40-meter drop creates a natural amphitheater, where crystalline waters perform an eternal dance against ancient volcanic rock. But it's just the first stop on our journey through the Philippines' hidden hydro-havens. In Antique province, we discover Igpasungaw Falls, a three-tiered wonder that local elders call ""Nature's Stairway to Heaven."" The lowest tier serves as a natural spa where tiny fish offer free pedicures, while the upper cascades hide behind a maze of giant ferns that have witnessed centuries of history. Further north, in the mountains of Nueva Vizcaya, Dupinga Falls presents itself like a shy debutante behind a veil of morning fog. Its waters, stained a subtle shade of turquoise by mineral deposits, spill over limestone ledges carved by time itself. Local Igorot tribes still perform traditional ceremonies here during the harvest season, maintaining a connection to their ancestors through the endless flow of water. ""Each waterfall has its own personality,"" Manuel explains as we rest on sun-warmed rocks. ""Some are playful, others mysterious. But all of them demand respect."" He's right – these hidden gems have remained pristine precisely because they're protected by both distance and local stewardship. Before heading back, we make one final stop at the twin cascades of Binulawan Falls in Leyte. Here, the water appears to glow golden in the late afternoon sun – a phenomenon that gave the falls their name, which means ""made of gold"" in Waray. Local legends speak of enchanted beings guarding ancient treasures behind the curtain of water, though the real treasure might be the falls themselves. For those brave enough to venture beyond the beaten path, these hidden waterfalls offer more than just spectacular views – they provide windows into the Philippines' soul, where nature and culture flow together in an eternal dance. Just remember to tread lightly and listen carefully; sometimes the most profound experiences come in the form of whispers rather than roars. [Note: Some locations intentionally keep low profiles to preserve their natural state. Always seek local guides and secure necessary permits before visiting.]""]",Travel,PH,en
Whispers of the Pacific: My Night Among Dancing Waves,,"[""The rhythmic pulse of waves against weathered rocks became my midnight lullaby as I lay in my tent, mere meters from the shoreline of Nagsasa Cove. Like many urban-weary souls seeking refuge from Manila's concrete jungle, I had chosen to trade my memory foam mattress for a sleeping bag and the stars of Zambales as my ceiling. The art of coastal camping in the Philippines isn't just about picking a pretty beach - it's about reading the tides like ancient manuscripts and befriending the wind that carries stories from distant shores. As dusk painted the sky in watercolor hues, I watched local fishermen return with their bounty, their wooden bancas cutting elegant silhouettes against the dying light. Setting up camp requires a delicate dance with nature. Choose your spot too close to the waterline, and high tide becomes an unwelcome tentmate. Too far into the tree line, and you'll miss the symphony of waves that makes beach camping magical. I found my sweet spot beneath a cluster of agoho trees, their wispy needles creating nature's own awning. The real magic begins when darkness falls. Away from the city's light pollution, the night sky transforms into a glittering tapestry that would make even the most jaded traveler pause in wonder. Between the constellations, I spotted the familiar flicker of fishermen's lamps dotting the horizon, a reminder that the sea never truly sleeps. Morning brings its own rewards. There's something profound about unzipping your tent to witness the sun emerging from the ocean, painting everything in gold. As I prepared my breakfast of locally sourced bangus and sinangag over a small camping stove, I watched hermit crabs conduct their morning meetings along the tideline. For those venturing into coastal camping, remember: timing is everything. Plan around the moon's phases - full moons mean higher tides. Pack light but smart - a good groundsheet is worth its weight in gold. And most importantly, respect the shoreline's rhythm. The beach isn't just a campground; it's a living ecosystem that has hosted countless travelers before us. As I packed up my site, leaving only footprints in the sand, I understood why our ancestors felt such a deep connection to the coast. There's wisdom in the waves, peace in the salt air, and if you listen carefully enough, stories in every shell that washes ashore. The wilderness of our shores offers more than just an escape - it offers a return to something fundamentally human.""]",Travel,PH,en
Unlock Your Lola's Secret Medicine Cabinet: Ancient Filipino Ingredients Making a Modern Comeback,,"[""In the heart of every Filipino kitchen lies a treasure trove of healing ingredients that our grandmothers swore by. Today, as the world catches up to what our ancestors knew all along, these humble superfoods are taking center stage in the global wellness revolution. Remember those mornings when your lola would insist on serving malunggay in your tinola? She wasn't just following tradition – she was giving you one of nature's most powerful nutritional powerhouses. Packed with more vitamin C than oranges and more calcium than milk, malunggay (moringa) has earned its spotlight in contemporary wellness circles, with international health experts dubbing it the ""miracle tree."" But that's just the tip of the iceberg when it comes to our local wellness warriors. Take the purple wonder that is ube. Beyond its Instagram-worthy violet hue and beloved role in desserts, this root crop is loaded with antioxidants that fight aging and boost immune function. ""Masarap na, healthy pa!"" as we Filipinos love to say. The humble saluyot, often overlooked in modern Filipino kitchens, is making a comeback as a premium leafy green. Rich in iron and fiber, it's becoming the go-to ingredient for health-conscious urbanites looking to connect with their roots while boosting their nutrition game. Who knew our simple ginisang saluyot could compete with trendy foreign superfoods? Let's not forget turmeric, or luyang dilaw – the golden spice that's been a staple in traditional Filipino medicine. Long before golden lattes became a café trend, our ancestors were using it to fight inflammation and boost immunity. Mix it with ginger and calamansi, and you've got yourself a powerful defense system in a cup. Speaking of calamansi, this tiny citrus fruit packs a mighty punch. While the rest of the world catches on to its immune-boosting properties, we've been enjoying its benefits in everything from our morning juice to our favorite sawsawan. It's proof that sometimes the best things come in small, very Filipino packages. Want to incorporate these superfoods into your modern lifestyle? Start small. Add malunggay to your smoothies, swap your morning coffee for salabat (ginger tea), or sprinkle toasted dilis (anchovies) – rich in calcium and omega-3 – on your salads. These simple switches honor our culinary heritage while boosting our health in ways that would make our lolas proud. The next time you're tempted by imported superfoods, remember: some of the world's most powerful nutritional treasures have been sitting in Filipino kitchens all along. Perhaps it's time we all took a page from our grandmother's cookbook – after all, lola really did know best.""]",Health,PH,en
The Rice Bowl Revolution: Why Your Lola's Portion Size Was Right All Along,,"[""Growing up in Filipino households, many of us remember our grandmothers scolding us about leaving rice on our plates. ""Sayang ang pagkain!"" they'd say. But what if our lolas were onto something beyond just avoiding waste? Modern nutrition science is revealing that traditional Asian portion control might hold the key to better health. Picture this: your typical Filipino meal plate. The mound of rice, the ulam, and perhaps some gulay on the side. While this familiar setup brings comfort, it's time to look at it with fresh eyes. Our ancestors naturally practiced portion control through simple tools – the traditional rice bowl, for instance, typically holds about one cup of rice, perfectly portioned for most adults. But here's where it gets interesting: Filipino food naturally follows a balanced macro distribution when served traditionally. Take the classic tinola – the protein from chicken, carbs from rice, and nutrients from malunggay and sayote create an intuitive balance that nutritionists now praise. It's not about counting calories; it's about listening to generations of wisdom. Let's break down the magic numbers: - Rice portion: Use your rice bowl (about 1 cup) - Protein: Think matchbox-size for meat or fish - Vegetables: Fill one-third of your plate - Sawsawan: Yes, even condiments matter! One tablespoon is usually enough The secret lies in the ""sapat lang"" principle – just enough to satisfy. Modern research suggests this approach naturally aligns with recommended macro ratios: 50-60% carbohydrates, 20-30% protein, and 20-30% healthy fats. Sound complicated? Your lola would simply say, ""Konting kanin, maraming gulay, and protein na sapat lang."" Here's how to make it work today: • Use smaller plates (like our ancestors did) • Serve rice last (after loading up on vegetables) • Practice the ""kutsarang patong"" method – no heaping spoons • Listen to your body's ""busog pero hindi binubursting"" signals Remember, balancing macros doesn't mean abandoning tradition – it means understanding why these traditions worked. Next time you're portioning your meal, think of your lola's wisdom: sometimes the old ways are the best ways, backed by both science and generations of experience. So, shall we revolution-rice our eating habits? Your lola would be proud.""]",Health,PH,en
